clean_document_sentences,reader_attention_of_each_word,average_reader_attention,sentence_length
u geological survey first reported magnitude 5 3 quake soon revised 5 1 every moderately sized quake geologists warned 5 chance larger quake next days,"[3.5200771602704114e-40, 2.824453764053641e-34, 1.185295664399903e-38, 1.891161984838563e-42, 7.302011915387104e-55, 1.6346494391227803e-45, 3.5997735186027264e-35, 2.4789309550823894e-46, 8.552212263055598e-54, 1.936806690356947e-40, 1.1886001570435807e-32, 5.638878225874388e-33, 3.698407838981442e-35, 3.7707860730825175e-36, 5.178041783389338e-39, 2.333570571195672e-45, 2.2973969559166618e-36, 1.7854010813543483e-50, 4.759456954436944e-43, 9.24705518804479e-34, 7.287781286197967e-39, 2.997473110121378e-48, 3.990924688726263e-41, 1.920022474153162e-45, 6.2486079944733265e-43]",7.524442238200135e-34,25
scientists u geological survey said last decade especially quake activity los angeles region abnormally quiet,"[1.2784387316565114e-43, 5.165489046650913e-56, 4.544613980725806e-37, 2.7613920175179295e-45, 1.1987688400280527e-31, 8.984171649746664e-52, 2.088873737519556e-46, 1.7229323845042935e-44, 4.4369267097382085e-42, 2.631596938095575e-32, 2.643031684904082e-32, 1.0176919696585038e-19, 5.765208761104752e-30, 4.106468249349106e-30, 9.902585200844294e-35]",6.784613131726319e-21,15
recent quakes may indicate return normal seismic activity geologists said emergency service officials urged residents use quake wake call prepare big one large devastating quake expected hit southern california,"[3.548534167620401e-38, 5.110554555061396e-33, 1.9562690967938987e-28, 4.00820789622741e-41, 3.255804378973453e-37, 3.341428053174998e-44, 1.4115944888866695e-33, 1.31357555551092e-57, 1.2886435969993185e-46, 5.6934277244531585e-39, 7.90012890478902e-51, 5.945077558089739e-39, 2.289514619528507e-46, 8.902432102147102e-42, 9.25751940032035e-53, 8.803998647661271e-41, 4.359060635660386e-51, 7.219881097187206e-50, 1.6769999785163563e-37, 1.6135120295399133e-46, 2.281689004721232e-50, 6.586468267374786e-54, 9.12944942057035e-27, 7.714834572723105e-51, 2.7787239128751904e-39, 3.176737828098432e-39, 2.003380752184155e-34, 3.353186782804601e-41, 2.5395438062277414e-40]",3.2155458804426356e-28,29
friday night quake also proved another successful test early warning system test phase california institute technology gives geologists seconds warning shaking starts,"[3.3503593445965764e-32, 4.225304931938473e-37, 3.7787600170761274e-44, 5.775958104418951e-35, 3.6732232064922454e-40, 8.558573491811877e-42, 1.6665371213302207e-23, 7.235989183559727e-36, 4.6946645062995605e-30, 1.2043900972656738e-39, 2.0212037749884201e-47, 1.2780416462237906e-25, 5.599468040766889e-42, 1.6495604466926938e-24, 7.136278877953768e-47, 1.3732527590014215e-48, 7.820188223705121e-34, 4.1530044238467367e-29, 6.643095002818136e-40, 4.6972772075960945e-34, 8.278154853228572e-58, 2.584539184772105e-45]",8.383082765521265e-25,22
geologists said could yet pinpoint fault involved,"[2.072276162375607e-39, 3.441319249339185e-40, 3.782389009837036e-43, 2.1406613143613793e-29, 1.3838555467069198e-29, 3.399871910337699e-38, 5.960425559173144e-45]",5.0350240924426424e-30,7
